semester_no,subject_id,subject_name,credits,course_type,elective_group,is_required
1,LA1003,Anh văn 1,2,BẮT BUỘC,,True
1,MT1007,Đại số Tuyến tính,3,BẮT BUỘC,,True
1,MT1003,Giải tích 1,4,BẮT BUỘC,,True
1,PH1003,Vật lý 1,4,BẮT BUỘC,,True
1,PH1007,Thí nghiệm Vật lý,1,BẮT BUỘC,,True
1,TR1001,Nhập môn Về Kỹ thuật,3,BẮT BUỘC,,True
1,PE1009,Bóng đá (Học phần 1),0,Thể dục (Chọn 1),PE,False
1,PE1011,Bóng chuyền (Học phần 1),0,Thể dục (Chọn 1),PE,False
1,PE1013,Bóng bàn (Học phần 1),0,Thể dục (Chọn 1),PE,False
1,PE1015,Bóng rổ (Học phần 1),0,Thể dục (Chọn 1),PE,False
1,PE1017,Cầu lông (Học phần 1),0,Thể dục (Chọn 1),PE,False
1,PE1019,Bơi (học Phần 1),0,Thể dục (Chọn 1),PE,False
1,PE1021,Aerobic (học Phần 1),0,Thể dục (Chọn 1),PE,False
1,PE1025,Điền kinh (Học phần 1),0,Thể dục (Chọn 1),PE,False
1,PE1027,Quần vợt (Học phần 1),0,Thể dục (Chọn 1),PE,False
1,PE1053,Cờ vua (Học phần 1),0,Thể dục (Chọn 1),PE,False
1,PE1057,Bowling (học phần 1),0,Thể dục (Chọn 1),PE,False
1,PE1061,Pickleball (học phần 1),0,Thể dục (Chọn 1),PE,False
1,LA1005,Anh văn 2,2,BẮT BUỘC,,True
1,MI1003,Giáo dục Quốc phòng,0,BẮT BUỘC,,True
1,MT1005,Giải tích 2,4,BẮT BUỘC,,True
1,PH1005,Vật lý 2,4,BẮT BUỘC,,True
1,CH1003,Hóa đại cương,3,BẮT BUỘC,,True
1,AS2071,Cơ học kỹ thuật,3,BẮT BUỘC,,True
1,ME1005,Thực tập Cơ khí Đại cương 1,1,BẮT BUỘC,,True
1,PE1033,Bóng đá (Học phần 2),0,Thể dục (Chọn 1),PE,False
1,PE1035,Bóng chuyền (Học phần 2),0,Thể dục (Chọn 1),PE,False
1,PE1037,Bóng bàn (Học phần 2),0,Thể dục (Chọn 1),PE,False
1,PE1039,Bóng rổ (Học phần 2),0,Thể dục (Chọn 1),PE,False
1,PE1041,Cầu lông (Học phần 2),0,Thể dục (Chọn 1),PE,False
1,PE1043,Bơi (học Phần 2),0,Thể dục (Chọn 1),PE,False
1,PE1045,Aerobic (học Phần 2),0,Thể dục (Chọn 1),PE,False
1,PE1049,Điền kinh (học phần 2),0,Thể dục (Chọn 1),PE,False
1,PE1051,Quần vợt (Học phần 2),0,Thể dục (Chọn 1),PE,False
1,PE1055,Cờ vua (học phần 2),0,Thể dục (Chọn 1),PE,False
1,PE1059,Bowling (học phần 2),0,Thể dục (Chọn 1),PE,False
1,PE1063,Pickleball (học phần 2),0,Thể dục (Chọn 1),PE,False
1,LA1007,Anh văn 3,2,BẮT BUỘC,,True
1,MT2013,Xác suất và Thống kê,4,BẮT BUỘC,,True
1,TR1003,Vẽ kỹ thuật Giao thông,3,BẮT BUỘC,,True
1,CI2001,Sức bền Vật liệu,3,BẮT BUỘC,,True
1,ME2003,Nguyên lý máy,3,BẮT BUỘC,,True
1,LA1009,Anh văn 4,2,BẮT BUỘC,,True
1,SP1031,Triết học Mác - Lênin,3,BẮT BUỘC,,True
1,MT1009,Phương pháp tính,3,BẮT BUỘC,,True
1,TR2041,Kỹ thuật Cơ lưu chất - Nhiệt,4,BẮT BUỘC,,True
1,TR2007,Kết cấu Động cơ Đốt trong,3,BẮT BUỘC,,True
1,TR2013,Kết cấu Ô tô,3,BẮT BUỘC,,True
1,SP1033,Kinh tế Chính trị Mác - Lênin,2,BẮT BUỘC,,True
1,ME2007,Chi tiết máy,3,BẮT BUỘC,,True
1,TR3145,Lý Thuyết Ô tô,3,BẮT BUỘC,,True
1,TR3143,Động cơ Đốt trong,3,BẮT BUỘC,,True
1,TR3075,Thực tập Kỹ thuật Ô tô,2,BẮT BUỘC,,True
1,IM1013,Kinh tế học Đại cương,3,TỰ CHỌN NHÓM A,A,False
1,IM1027,Kinh tế Kỹ thuật,3,TỰ CHỌN NHÓM A,A,False
1,IM3001,Quản trị Kinh doanh cho Kỹ sư,3,TỰ CHỌN NHÓM A,A,False
1,IM1025,Quản lý Dự án cho Kỹ sư,3,TỰ CHỌN NHÓM A,A,False
1,IM1023,Quản lý Sản xuất cho Kỹ sư,0,TỰ CHỌN NHÓM A,A,False
1,IM1031,Khởi nghiệp và đổi mới sáng tạo,3,TỰ CHỌN NHÓM A,A,False
1,ME1019,Quản lý năng suất và chất lượng,3,TỰ CHỌN NHÓM A,A,False
1,SP1035,Chủ nghĩa Xã hội Khoa học,2,BẮT BUỘC,,True
1,TR3119,Thí nghiệm Ô tô và Động cơ đốt trong,3,BẮT BUỘC,,True
1,TR3121,Hệ thống Điện - Điện tử Ô tô,3,BẮT BUỘC,,True
1,TR3123,Kỹ thuật Khai thác và Bảo dưỡng Động cơ - Ô tô,3,BẮT BUỘC,,True
1,TR3345,Thực tập Ngoài trường,2,BẮT BUỘC,,True
1,SP1039,Lịch sử Đảng Cộng sản Việt Nam,2,BẮT BUỘC,,True
1,SP1007,Pháp luật Việt Nam Đại cương,2,BẮT BUỘC,,True
1,TR4085,Phương pháp Thiết kế động cơ và Ô tô,3,BẮT BUỘC,,True
1,TR4089,Điều khiển Tự động trên Ô tô,3,BẮT BUỘC,,True
1,TR4091,Đồ án Chuyên ngành,2,BẮT BUỘC,,True
1,TR4087,Công nghệ Ô tô,3,BẮT BUỘC,,True
1,TR4347,Đồ án Tốt nghiệp,4,BẮT BUỘC,,True
1,SP1037,Tư tưởng Hồ Chí Minh,2,BẮT BUỘC,,True
1,EN1003,Con người và Môi trường,3,BẮT BUỘC,,True
1,SA4001,Hoạt động sinh viên,0,BẮT BUỘC,,True
