semester_no,subject_id,subject_name,credits,course_type,elective_group,is_required
1,LA1003,Anh văn 1,2,BẮT BUỘC,,True
1,MT1007,Đại số Tuyến tính,3,BẮT BUỘC,,True
1,MT1003,Giải tích 1,4,BẮT BUỘC,,True
1,PH1003,Vật lý 1,4,BẮT BUỘC,,True
1,PH1007,Thí nghiệm Vật lý,1,BẮT BUỘC,,True
1,EE1001,Nhập môn Về kỹ Thuật,3,BẮT BUỘC,,True
1,PE1009,Bóng đá (Học phần 1),0,Thể dục (Chọn 1),PE,False
1,PE1011,Bóng chuyền (Học phần 1),0,Thể dục (Chọn 1),PE,False
1,PE1013,Bóng bàn (Học phần 1),0,Thể dục (Chọn 1),PE,False
1,PE1021,Aerobic (học Phần 1),0,Thể dục (Chọn 1),PE,False
1,PE1015,Bóng rổ (Học phần 1),0,Thể dục (Chọn 1),PE,False
1,PE1017,Cầu lông (Học phần 1),0,Thể dục (Chọn 1),PE,False
1,PE1025,Điền kinh (Học phần 1),0,Thể dục (Chọn 1),PE,False
1,PE1019,Bơi (học Phần 1),0,Thể dục (Chọn 1),PE,False
1,PE1027,Quần vợt (Học phần 1),0,Thể dục (Chọn 1),PE,False
1,PE1053,Cờ vua (Học phần 1),0,Thể dục (Chọn 1),PE,False
1,PE1057,Bowling (học phần 1),0,Thể dục (Chọn 1),PE,False
1,PE1061,Pickleball (học phần 1),0,Thể dục (Chọn 1),PE,False
2,LA1005,Anh văn 2,2,BẮT BUỘC,,True
2,MT1005,Giải tích 2,4,BẮT BUỘC,,True
2,EE1007,Vật lý Bán dẫn,4,BẮT BUỘC,,True
2,MT1009,Phương pháp tính,3,BẮT BUỘC,,True
2,CH1003,Hóa đại cương,3,BẮT BUỘC,,True
2,MI1003,Giáo dục Quốc phòng,0,BẮT BUỘC,,True
2,PE1037,Bóng bàn (Học phần 2),0,Thể dục (Chọn 1),PE,False
2,PE1041,Cầu lông (Học phần 2),0,Thể dục (Chọn 1),PE,False
2,PE1033,Bóng đá (Học phần 2),0,Thể dục (Chọn 1),PE,False
2,PE1045,Aerobic (học Phần 2),0,Thể dục (Chọn 1),PE,False
2,PE1043,Bơi (học Phần 2),0,Thể dục (Chọn 1),PE,False
2,PE1039,Bóng rổ (Học phần 2),0,Thể dục (Chọn 1),PE,False
2,PE1035,Bóng chuyền (Học phần 2),0,Thể dục (Chọn 1),PE,False
2,PE1049,Điền kinh (học phần 2),0,Thể dục (Chọn 1),PE,False
2,PE1051,Quần vợt (Học phần 2),0,Thể dục (Chọn 1),PE,False
2,PE1055,Cờ vua (học phần 2),0,Thể dục (Chọn 1),PE,False
2,PE1063,Pickleball (học phần 2),0,Thể dục (Chọn 1),PE,False
2,PE1059,Bowling (học phần 2),0,Thể dục (Chọn 1),PE,False
3,LA1007,Anh văn 3,2,BẮT BUỘC,,True
3,MT2013,Xác suất và Thống kê,4,BẮT BUỘC,,True
3,EE2033,Giải tích mạch,3,BẮT BUỘC,,True
3,EE1009,Kỹ thuật số,3,BẮT BUỘC,,True
3,EE2081,Ngôn ngữ lập trình,3,BẮT BUỘC,,True
3,SP1007,Pháp luật Việt Nam Đại cương,2,BẮT BUỘC,,True
4,LA1009,Anh văn 4,2,BẮT BUỘC,,True
4,EE2003,Trường điện từ,3,BẮT BUỘC,,True
4,EE2005,Tín hiệu và Hệ thống,3,BẮT BUỘC,,True
4,EE2039,Vi xử lý,3,BẮT BUỘC,,True
4,EE2035,Mạch điện tử,3,BẮT BUỘC,,True
4,SP1031,Triết học Mác - Lênin,3,BẮT BUỘC,,True
5,EE2015,Xử lý số Tín hiệu,3,BẮT BUỘC,,True
5,EE3003,Thiết kế Hệ thống Nhúng,3,BẮT BUỘC,,True
5,EE3015,Kỹ thuật Hệ thống Viễn Thông,3,BẮT BUỘC,,True
5,EE2025,Thực tập Điện 1,1,BẮT BUỘC,,True
5,EE2023,Thực tập Điện tử 1,1,BẮT BUỘC,,True
5,SP1033,Kinh tế Chính trị Mác - Lênin,2,BẮT BUỘC,,True
5,IM1023,Quản lý Sản xuất cho Kỹ sư,3,TỰ CHỌN NHÓM B,B,False
5,IM1025,Quản lý Dự án cho Kỹ sư,3,TỰ CHỌN NHÓM B,B,False
5,IM3001,Quản trị Kinh doanh cho Kỹ sư,3,TỰ CHỌN NHÓM B,B,False
5,IM1031,Khởi nghiệp và đổi mới sáng tạo,3,TỰ CHỌN NHÓM B,B,False
6,EE3019,Truyền số liệu và Mạng,3,BẮT BUỘC,,True
6,EE3011,Mạch điện tử Thông tin,3,BẮT BUỘC,,True
6,EE3165,Thiết kế Vi mạch,3,BẮT BUỘC,,True
6,EE3021,Thực tập Điện tử 2,1,BẮT BUỘC,,True
6,SP1035,Chủ nghĩa Xã hội Khoa học,2,BẮT BUỘC,,True
6,EE3183,Đồ án 1 (Kỹ thuật Điện tử - Viễn thông),1,BẮT BUỘC,,True
6,EE3365,Thực tập Ngoài trường,2,BẮT BUỘC,,True
6,EN1003,Con người và Môi trường,3,TỰ CHỌN NHÓM C,C,False
6,ME1019,Quản lý năng suất và chất lượng,3,TỰ CHỌN NHÓM C,C,False
7,EE3025,Kỹ thuật Siêu cao tần,3,BẮT BUỘC,,True
7,EE4011,Đồ án 2 (Kỹ thuật Điện tử - Viễn thông),2,BẮT BUỘC,,True
7,SP1039,Lịch sử Đảng Cộng sản Việt Nam,2,BẮT BUỘC,,True
7,EE3031,Lập trình Hệ thống nhúng,3,TỰ CHỌN NHÓM A,A,False
7,EE3035,Xử lý ảnh,3,TỰ CHỌN NHÓM A,A,False
7,EE3037,Điện tử Y sinh,3,TỰ CHỌN NHÓM A,A,False
7,EE3041,Xử lý Tín hiệu số với FPGA,3,TỰ CHỌN NHÓM A,A,False
7,EE3043,Cấu trúc Máy tính,3,TỰ CHỌN NHÓM A,A,False
7,EE3085,Mạng viễn thông,3,TỰ CHỌN NHÓM A,A,False
7,EE3107,Thông tin Di động,3,TỰ CHỌN NHÓM A,A,False
7,EE3111,Mạng máy tính,3,TỰ CHỌN NHÓM A,A,False
7,EE3117,Thiết kế Vi mạch số,3,TỰ CHỌN NHÓM A,A,False
7,EE3121,Thiết kế Vi mạch Tương tự và Hỗn hợp,3,TỰ CHỌN NHÓM A,A,False
7,EE3127,Anten - Truyền sóng Vô tuyến,3,TỰ CHỌN NHÓM A,A,False
7,EE3129,Điện tử Ứng dụng,3,TỰ CHỌN NHÓM A,A,False
7,EE3167,Thiết kế và Phát triển Ứng dụng IoT,3,TỰ CHỌN NHÓM A,A,False
7,EE3169,Máy học Cơ bản và Ứng dụng,3,TỰ CHỌN NHÓM A,A,False
7,EE3177,Chuyên đề điện tử - viễn thông,3,TỰ CHỌN NHÓM A,A,False
8,SP1037,Tư tưởng Hồ Chí Minh,2,BẮT BUỘC,,True
8,EE4367,Đồ án Tốt nghiệp,4,BẮT BUỘC,,True
